Name,Description,Fulladdress,Street,Municipality,Categories,About,Plus Code,Time Zone,Price,Note,Amenities,Hotel Class,Phone,Phones,Claimed,Owner,Owner Id,Owner Link,Email,Social Medias,Review Count,Average Rating,Review URL,Google Maps URL,Google Knowledge URL,Latitude,Longitude,Website,Domain,Opening Hours,Featured Image,Cid,Fid,Place Id,Kgmid
Wurundjeri Spur Lookout,,"Yarra Blvd, Kew VIC 3101",Yarra Blvd,Kew VIC 3101,"Tourist attraction, Scenic spot",Accessibility: [Wheelchair-accessible car park],4RJ76269+J6,Australia/Melbourne,,,,,,,NO,Wurundjeri Spur Lookout (owner),,,,,334,4.5,https://search.google.com/local/reviews?placeid=ChIJxRjXxZBD1moRaIl7WG-oVEM&q=Things+to+do&authuser=0&hl=en&gl=AU,https://www.google.com/maps?cid=4851687894764194152,https://www.google.com/search?kgmid=/g/11ddxsb47m,-37.7884529,145.0180067,https://www.parks.vic.gov.au/,parks.vic.gov.au,"Wednesday: [Open 24 hours], Thursday: [Open 24 hours], Friday: [Open 24 hours], Saturday: [Open 24 hours], Sunday: [Open 24 hours], Monday: [Open 24 hours], Tuesday: [Open 24 hours]",https://lh5.googleusercontent.com/p/AF1QipO1v1YZTKE5bgf-dWVqMKLnrBLrmR_5d0kC2-wx=w138-h92-k-no,4.85169e+18,0x6ad64390c5d718c5:0x4354a86f587b8968,ChIJxRjXxZBD1moRaIl7WG-oVEM,/g/11ddxsb47m
Mount Cooper Lookout,,"Mount Cooper Scenic Dr, Bundoora VIC 3083",Mount Cooper Scenic Dr,Bundoora VIC 3083,"Tourist attraction, Vista point","Accessibility: [Wheelchair-accessible car park, Wheelchair-accessible entrance]",4RJ772XX+Q2,Australia/Melbourne,,,,,(03) 8470 8170,"(03) 8470 8170, +61 3 8470 8170",YES,Mount Cooper Lookout (owner),,,,,629,4.5,https://search.google.com/local/reviews?placeid=ChIJwfcSZE1P1moR3avSwCxuISc&q=Things+to+do&authuser=0&hl=en&gl=AU,https://www.google.com/maps?cid=2819655980203289565,https://www.google.com/search?kgmid=/g/11bxdthz2j,-37.7005744,145.0475392,,,"Wednesday: [Open 24 hours], Thursday: [Open 24 hours], Friday: [Open 24 hours], Saturday: [Open 24 hours], Sunday: [Open 24 hours], Monday: [Open 24 hours], Tuesday: [Open 24 hours]",https://lh5.googleusercontent.com/p/AF1QipPS9vReSXK3oYOS3CImajwYMw7QgsnzzkqO4K3F=w122-h92-k-no,2.81966e+18,0x6ad64f4d6412f7c1:0x27216e2cc0d2abdd,ChIJwfcSZE1P1moR3avSwCxuISc,/g/11bxdthz2j
Edinburgh Gardens,"Sprawling green space with tennis courts, a football pitch, skate park & off-leash dog areas.","Alfred Cres, Fitzroy North VIC 3068",Alfred Cres,Fitzroy North VIC 3068,"Tourist attraction, Park","Service options: [On-site services], Accessibility: [Wheelchair-accessible car park, Wheelchair-accessible entrance], Amenities: [Barbecue grill, Basketball court, Has a tennis court, Picnic tables, Public toilet, Skateboarding area, Slides, Swings], Children: [Good for kids, Good for kids birthday, Playground], Pets: [Dog park, Dogs allowed]",4RJ66X7M+35,Australia/Melbourne,,,,,(03) 9205 5555,"(03) 9205 5555, +61 3 9205 5555",YES,Edinburgh Gardens (owner),1.15845e+20,https://www.google.com/maps/contrib/115845082094708764177,"info@yarracity.vic.gov.au, yarraleisure@yarracity.vic.gov.au, yarralibraries@yarracity.vic.gov.au",,2678,4.7,https://search.google.com/local/reviews?placeid=ChIJXetR8z1D1moRIOkxBXZWBA8&q=Things+to+do&authuser=0&hl=en&gl=AU,https://www.google.com/maps?cid=1082084875369048352,https://www.google.com/search?kgmid=/m/09z7vr,-37.7873691,144.9829997,https://www.yarracity.vic.gov.au/facilities/edinburgh-gardens,yarracity.vic.gov.au,"Wednesday: [Open 24 hours], Thursday: [Open 24 hours], Friday: [Open 24 hours], Saturday: [Open 24 hours], Sunday: [Open 24 hours], Monday: [Open 24 hours], Tuesday: [Open 24 hours]",https://lh5.googleusercontent.com/p/AF1QipPuljUeeydSVAolFNqF-FSmSbJRnCioe9GNOk1V=w80-h106-k-no,1.08208e+18,0x6ad6433df351eb5d:0xf0456760531e920,ChIJXetR8z1D1moRIOkxBXZWBA8,/m/09z7vr
Carlton Gardens,Landscaped Victorian-era park now containing the Royal Exhibition Building and Melbourne Museum.,"1-111 Carlton St, Carlton VIC 3053",1-111 Carlton St,Carlton VIC 3053,"Tourist attraction, Garden","Accessibility: [Wheelchair-accessible car park, Wheelchair-accessible entrance], Amenities: [Picnic tables, Public toilet], Children: [Good for kids], Pets: [Dogs allowed]",4RJ65XVC+RH,Australia/Melbourne,,,,,(03) 9658 9658,"(03) 9658 9658, +61 3 9658 9658",NO,Carlton Gardens (owner),,,,,12983,4.6,https://search.google.com/local/reviews?placeid=ChIJf6HEetBC1moREEcyBXZWBA8&q=Things+to+do&authuser=0&hl=en&gl=AU,https://www.google.com/maps?cid=1082084875369072400,https://www.google.com/search?kgmid=/m/05k05z,-37.8054312,144.9714124,http://www.melbourne.vic.gov.au/,melbourne.vic.gov.au,"Wednesday: [Open 24 hours], Thursday: [Open 24 hours], Friday: [Open 24 hours], Saturday: [Open 24 hours], Sunday: [Open 24 hours], Monday: [Open 24 hours], Tuesday: [Open 24 hours]",https://lh5.googleusercontent.com/p/AF1QipPly3Wcsqp0jC7w0RTpk2q7zbfdi1PYS5Iw46TO=w162-h92-k-no,1.08208e+18,0x6ad642d07ac4a17f:0xf04567605324710,ChIJf6HEetBC1moREEcyBXZWBA8,/m/05k05z
National Gallery of Victoria,"Public gallery with vast, varied collection of noted Australian and international art and artefacts.","180 St Kilda Rd, Melbourne VIC 3006",180 St Kilda Rd,Melbourne VIC 3006,"Tourist attraction, Art gallery","Service options: [On-site services], Highlights: [Live performances], Accessibility: [Wheelchair-accessible car park, Wheelchair-accessible entrance, Wheelchair-accessible toilet], Amenities: [Restaurant, Toilets], Children: [Good for kids]",4RJ65XG9+XH,Australia/Melbourne,,,,,(03) 8620 2222,"(03) 8620 2222, +61 3 8620 2222",YES,National Gallery of Victoria (owner),1.01563e+20,https://www.google.com/maps/contrib/101563340905304757755,,,21631,4.7,https://search.google.com/local/reviews?placeid=ChIJuYNitLFC1moRVB5vMAKPcTM&q=Things+to+do&authuser=0&hl=en&gl=AU,https://www.google.com/maps?cid=3706901207867924052,https://www.google.com/search?kgmid=/m/0hhhs,-37.8225942,144.9689278,https://www.ngv.vic.gov.au/,ngv.vic.gov.au,"Wednesday: [10 am-5 pm], Thursday: [10 am-5 pm], Friday: [10 am-5 pm], Saturday: [10 am-5 pm], Sunday: [10 am-5 pm], Monday: [10 am-5 pm], Tuesday: [10 am-5 pm]",https://lh5.googleusercontent.com/p/AF1QipMBwsYfFhzSaKZ-E4yOioJB834E5tDZl3FO2YP-=w92-h92-k-no,3.7069e+18,0x6ad642b1b46283b9:0x33718f02306f1e54,ChIJuYNitLFC1moRVB5vMAKPcTM,/m/0hhhs
Old Melbourne Gaol,"Now a museum with self & guided tours, this storied tri-level jail once housed notorious inmates.","377 Russell St, Melbourne VIC 3000",377 Russell St,Melbourne VIC 3000,"Tourist attraction, Museum","Service options: [On-site services], Accessibility: [Wheelchair-accessible car park, Wheelchair-accessible entrance, Wheelchair-accessible toilet], Amenities: [Toilets, No restaurant], Children: [Good for kids]",4RJ65XR8+V4,Australia/Melbourne,,,,,(03) 9656 9889,"(03) 9656 9889, +61 3 9656 9889",YES,Old Melbourne Gaol (owner),1.16245e+20,https://www.google.com/maps/contrib/116244843089957449305,,,3205,4.5,https://search.google.com/local/reviews?placeid=ChIJYUcwasxC1moResepeNQs7Z0&q=Things+to+do&authuser=0&hl=en&gl=AU,https://www.google.com/maps?cid=11379801124504192890,https://www.google.com/search?kgmid=/m/04fb5r,-37.807832,144.9653171,http://www.oldmelbournegaol.com.au/,oldmelbournegaol.com.au,"Wednesday: [10 am-5 pm], Thursday: [10 am-5 pm], Friday: [10 am-5 pm], Saturday: [10 am-5 pm], Sunday: [10 am-5 pm], Monday: [10 am-5 pm], Tuesday: [10 am-5 pm]",https://lh5.googleusercontent.com/p/AF1QipNY7qEdyG0kOWeX84eawghm_rDpWVlrdKf7bP9R=w80-h96-k-no,1.13798e+19,0x6ad642cc6a304761:0x9ded2cd478a9c77a,ChIJYUcwasxC1moResepeNQs7Z0,/m/04fb5r
Buluk Park Playground,,"107 Victoria Harbour Promenade, Docklands VIC 3008",107 Victoria Harbour Promenade,Docklands VIC 3008,"Tourist attraction, Park, Playground","Accessibility: [Wheelchair-accessible car park, Wheelchair-accessible entrance], Amenities: [Slides]",4RJ65WHR+V9,Australia/Melbourne,,,,,,,NO,Buluk Park Playground (owner),,,,,214,4.4,https://search.google.com/local/reviews?placeid=ChIJUVHNRl5d1moR7p2p2zII8S0&q=Things+to+do&authuser=0&hl=en&gl=AU,https://www.google.com/maps?cid=3310436215620738542,https://www.google.com/search?kgmid=/g/11bxb9qhwk,-37.8203434,144.9409475,,,"Wednesday: [Open 24 hours], Thursday: [Open 24 hours], Friday: [Open 24 hours], Saturday: [Open 24 hours], Sunday: [Open 24 hours], Monday: [Open 24 hours], Tuesday: [Open 24 hours]",https://lh5.googleusercontent.com/p/AF1QipMcQDzTNkD_2YNzZgKRKLSjIW4c1KsUFI3W-atF=w122-h92-k-no,3.31044e+18,0x6ad65d5e46cd5151:0x2df10832dba99dee,ChIJUVHNRl5d1moR7p2p2zII8S0,/g/11bxb9qhwk
Valley Conservation Reserve,,"80 Waimarie Dr, Mount Waverley VIC 3149",80 Waimarie Dr,Mount Waverley VIC 3149,"Tourist attraction, Park","Accessibility: [Wheelchair-accessible car park, Wheelchair-accessible entrance], Activities: [Hiking], Amenities: [Barbecue grill, Picnic tables, Public toilet, Slides, Swings], Children: [Good for kids, Good for kids birthday, Kid-friendly hikes, Playground], Pets: [Dogs allowed]",4RJ7449P+V3,Australia/Melbourne,,,,,(03) 9518 3555,"(03) 9518 3555, +61 3 9518 3555",NO,Valley Conservation Reserve (owner),,,,,647,4.6,https://search.google.com/local/reviews?placeid=ChIJa0i5aghA1moRdrPxDE6QI2M&q=Things+to+do&authuser=0&hl=en&gl=AU,https://www.google.com/maps?cid=7143712098838754166,https://www.google.com/search?kgmid=/g/1tjfgzs9,-37.8803493,145.1351993,https://www.monash.vic.gov.au/Things-to-Do/Parks-Recreation/Valley-Conservation-Reserve,monash.vic.gov.au,"Wednesday: [Open 24 hours], Thursday: [Open 24 hours], Friday: [Open 24 hours], Saturday: [Open 24 hours], Sunday: [Open 24 hours], Monday: [Open 24 hours], Tuesday: [Open 24 hours]",https://lh5.googleusercontent.com/p/AF1QipN5ZU_RwNNlvU6d-Zh0I8ykoJgHyR5RwjXJspK4=w80-h106-k-no,7.14371e+18,0x6ad640086ab9486b:0x6323904e0cf1b376,ChIJa0i5aghA1moRdrPxDE6QI2M,/g/1tjfgzs9
Darling Gardens,,"237 Gold St, Clifton Hill VIC 3068",237 Gold St,Clifton Hill VIC 3068,"Tourist attraction, Park","Service options: [On-site services], Accessibility: [Wheelchair-accessible car park, Wheelchair-accessible entrance], Amenities: [Picnic tables, Public toilet, Slides, Swings], Children: [Good for kids, Good for kids birthday, Playground], Pets: [Dogs allowed]",4RJ66X5R+HX,Australia/Melbourne,,,,,(03) 9205 5555,"(03) 9205 5555, +61 3 9205 5555",YES,Darling Gardens (owner),1.01237e+20,https://www.google.com/maps/contrib/101237305408503257362,"info@yarracity.vic.gov.au, yarraleisure@yarracity.vic.gov.au, yarralibraries@yarracity.vic.gov.au",,529,4.6,https://search.google.com/local/reviews?placeid=ChIJ6y6SlRFD1moRcH8xBXZWBA8&q=Things+to+do&authuser=0&hl=en&gl=AU,https://www.google.com/maps?cid=1082084875369021296,https://www.google.com/search?kgmid=/g/1tls2zrk,-37.7910336,144.9924946,https://www.yarracity.vic.gov.au/facilities/darling-gardens,yarracity.vic.gov.au,"Wednesday: [Open 24 hours], Thursday: [Open 24 hours], Friday: [Open 24 hours], Saturday: [Open 24 hours], Sunday: [Open 24 hours], Monday: [Open 24 hours], Tuesday: [Open 24 hours]",https://lh5.googleusercontent.com/p/AF1QipPFhj5f3Q3Y6KWWRbL-QNRLem5tX7SHr_oN0SNe=w122-h92-k-no,1.08208e+18,0x6ad6431195922eeb:0xf04567605317f70,ChIJ6y6SlRFD1moRcH8xBXZWBA8,/g/1tls2zrk
Point Nepean National Park,"National park with historic forts & a visitor centre, plus bike hire, walking tracks & beach access.","Ochiltree Rd, Portsea VIC 3944",Ochiltree Rd,Portsea VIC 3944,"Tourist attraction, Hiking area, National park","Accessibility: [Wheelchair-accessible car park, Wheelchair-accessible entrance], Activities: [Hiking], Amenities: [Barbecue grill, Picnic tables, Public toilet], Children: [Good for kids, Kid-friendly hikes]",4RH6MMPV+CG,Australia/Melbourne,,,,,13 19 63,"13 19 63, +61 131963",YES,Point Nepean National Park (owner),1.11913e+20,https://www.google.com/maps/contrib/111912597580139144295,,,2880,4.7,https://search.google.com/local/reviews?placeid=ChIJmfFUPg021GoR2nZ4aPSDWho&q=Things+to+do&authuser=0&hl=en&gl=AU,https://www.google.com/maps?cid=1898975278638069466,https://www.google.com/search?kgmid=/g/11bc6tv3yg,-38.3139447,144.6937963,https://www.parks.vic.gov.au/places-to-see/parks/point-nepean-national-park?utm_source=google&utm_medium=maps&utm_campaign=GMB-2020,parks.vic.gov.au,"Wednesday: [Open 24 hours], Thursday: [Open 24 hours], Friday: [Open 24 hours], Saturday: [Open 24 hours], Sunday: [Open 24 hours], Monday: [Open 24 hours], Tuesday: [Open 24 hours]",https://lh5.googleusercontent.com/p/AF1QipMClP4MvEZU591M48dXbr2b8RQtHGlbc7r2OLkH=w157-h92-k-no,1.89898e+18,0x6ad4360d3e54f199:0x1a5a83f4687876da,ChIJmfFUPg021GoR2nZ4aPSDWho,/g/11bc6tv3yg
Guilfoyle's Volcano,Restored circular 1876 botanical garden reservoir looped by a boardwalk with city panoramas.,"Royal Botanic Gardens Victoria - Melbourne Gardens, Birdwood Ave, South Yarra VIC 3141",Royal Botanic Gardens Victoria - Melbourne Gardens,Birdwood Ave,"Tourist attraction, Historical place, Garden","Accessibility: [Wheelchair-accessible car park, Wheelchair-accessible entrance], Amenities: [Public toilet], Children: [Good for kids]",4RJ65X9M+2C,Australia/Melbourne,,,,,(03) 9252 2300,"(03) 9252 2300, +61 3 9252 2300",YES,Guilfoyle's Volcano (owner),1.0114e+20,https://www.google.com/maps/contrib/101140157503302624941,,,577,4.7,https://search.google.com/local/reviews?placeid=ChIJn7QXophC1moRcngInUmnTwg&q=Things+to+do&authuser=0&hl=en&gl=AU,https://www.google.com/maps?cid=598881210072594546,https://www.google.com/search?kgmid=/g/11h1khc8w,-37.8324591,144.9836201,https://www.rbg.vic.gov.au/melbourne-gardens/discover-melbourne-gardens/melbourne-gardens-living-collections/guilfoyles-volcano/,rbg.vic.gov.au,"Wednesday: [7:30 am-5:30 pm], Thursday: [7:30 am-5:30 pm], Friday: [7:30 am-5:30 pm], Saturday: [7:30 am-5:30 pm], Sunday: [7:30 am-5:30 pm], Monday: [7:30 am-5:30 pm], Tuesday: [7:30 am-5:30 pm]",https://lh5.googleusercontent.com/p/AF1QipOmQdjj0WmAsJK-s5qXADnOD5Qn2-JJlrmIkxGE=w122-h92-k-no,5.98881e+17,0x6ad64298a217b49f:0x84fa7499d087872,ChIJn7QXophC1moRcngInUmnTwg,/g/11h1khc8w
Luna Park Melbourne,"Enduring amusement park known for its perimeter roller coaster and giant, ornate carousel.","18 Lower Esplanade, St Kilda VIC 3182",18 Lower Esplanade,St Kilda VIC 3182,"Tourist attraction, Amusement park, Event venue, Function room facility, Theme park, Wedding venue","Service options: [On-site services], Highlights: [Live performances], Accessibility: [Wheelchair-accessible car park, Wheelchair-accessible entrance, Wheelchair-accessible toilet], Amenities: [Baggage storage, Restaurant, Toilets, Wi-Fi, ], Crowd: [Family friendly], Planning: [Getting tickets in advance recommended], Children: [Discounts for kids, Family discount, Good for kids, Playground]",4RJ64XJG+VQ,Australia/Melbourne,,,,,(03) 9525 5033,"(03) 9525 5033, +61 3 9525 5033",YES,Luna Park Melbourne (owner),1.0827e+20,https://www.google.com/maps/contrib/108269774230285243985,,,8281,4.1,https://search.google.com/local/reviews?placeid=ChIJZ_cOG2Ro1moRQbFsJ6rXAL8&q=Things+to+do&authuser=0&hl=en&gl=AU,https://www.google.com/maps?cid=13763237587050082625,https://www.google.com/search?kgmid=/m/058ljj,-37.8678147,144.976924,https://www.lunapark.com.au/,lunapark.com.au,"Wednesday: [Closed], Thursday: [Closed], Friday: [6-10 pm], Saturday: [11 am-10 pm], Sunday: [11 am-6 pm], Monday: [Closed], Tuesday: [Closed]",https://lh5.googleusercontent.com/p/AF1QipPRvYF66N0Ke3FR6FrNYA7tEV_8Bw-B0ZuAdOSW=w80-h106-k-no,1.37632e+19,0x6ad668641b0ef767:0xbf00d7aa276cb141,ChIJZ_cOG2Ro1moRQbFsJ6rXAL8,/m/058ljj
Sherbrooke Falls,"Gravel path to a waterfall through ferns & tall ash trees, with sightings of wombats & blue parrots.","Odonohue Track, Sherbrooke VIC 3789",Odonohue Track,Sherbrooke VIC 3789,"Tourist attraction, Scenic spot",,4RJ74962+XR,Australia/Melbourne,,,,,13 19 63,"13 19 63, +61 131963",YES,Sherbrooke Falls (owner),1.17322e+20,https://www.google.com/maps/contrib/117321906904885337057,,,451,4.3,https://search.google.com/local/reviews?placeid=ChIJ9UvrQIIk1moRAEt9IANVKmY&q=Things+to+do&authuser=0&hl=en&gl=AU,https://www.google.com/maps?cid=7361790012808841984,https://www.google.com/search?kgmid=/g/11g01zzhft,-37.8876048,145.3520675,https://www.parks.vic.gov.au/places-to-see/parks/dandenong-ranges-national-park/things-to-do/sherbrooke-falls-walk-and-picnic-area?utm_source=google&utm_medium=maps&utm_campaign=GMB-2020,parks.vic.gov.au,"Wednesday: [Open 24 hours], Thursday: [Open 24 hours], Friday: [Open 24 hours], Saturday: [Open 24 hours], Sunday: [Open 24 hours], Monday: [Open 24 hours], Tuesday: [Open 24 hours]",https://lh5.googleusercontent.com/p/AF1QipPfu6vSzx-jUEKblp6sXmvzJeUboavUQVt4XYQ1=w157-h92-k-no,7.36179e+18,0x6ad6248240eb4bf5:0x662a5503207d4b00,ChIJ9UvrQIIk1moRAEt9IANVKmY,/g/11g01zzhft
Wilson Botanic Park Berwick,"39-hectare botanic garden with a visitor centre, bird hide & playground, plus picnic areas & trails.","668 Princes Hwy, Berwick VIC 3806",668 Princes Hwy,Berwick VIC 3806,"Tourist attraction, Botanical garden","Service options: [On-site services], Accessibility: [Wheelchair-accessible car park, Wheelchair-accessible entrance], Activities: [Hiking], Amenities: [Barbecue grill, Picnic tables, Public toilet, Slides, Swings], Children: [Good for kids, Good for kids birthday, Kid-friendly hikes, Playground], Pets: [Dogs allowed]",4RH7X8CP+XM,Australia/Melbourne,,,,,(03) 9705 5599,"(03) 9705 5599, +61 3 9705 5599",YES,Wilson Botanic Park Berwick (owner),1.02902e+20,https://www.google.com/maps/contrib/102901612233263425537,,,3512,4.7,https://search.google.com/local/reviews?placeid=ChIJ_-6QVIwZ1moRALAxBXZWBA8&q=Things+to+do&authuser=0&hl=en&gl=AU,https://www.google.com/maps?cid=1082084875369033728,https://www.google.com/search?kgmid=/m/0h60jf,-38.0275344,145.336743,https://www.casey.vic.gov.au/facilities-hire/wilson-botanic-park-berwick,casey.vic.gov.au,"Wednesday: [7 am-9 pm], Thursday: [7 am-9 pm], Friday: [7 am-9 pm], Saturday: [7 am-9 pm], Sunday: [7 am-9 pm], Monday: [7 am-9 pm], Tuesday: [7 am-9 pm]",https://lh5.googleusercontent.com/p/AF1QipO2W_4HgG05I_BqThjmiF02yTmRukRN0xQivMBQ=w138-h92-k-no,1.08208e+18,0x6ad6198c5490eeff:0xf0456760531b000,ChIJ_-6QVIwZ1moRALAxBXZWBA8,/m/0h60jf
Kokoda Track Memorial Walk,Scenic walking track in lush forest surrounds lined with plaques devoted to Australian soldiers.,"Tree Fern Gully Track, Tremont VIC 3785",Tree Fern Gully Track,Tremont VIC 3785,Tourist attraction,"Service options: [On-site services], Accessibility: [Wheelchair-accessible car park, Wheelchair-accessible entrance], Amenities: [Toilets], Children: [Good for kids]",4RJ74869+Q3,Australia/Melbourne,,,,,13 19 63,"13 19 63, +61 131963",YES,Kokoda Track Memorial Walk (owner),1.10936e+20,https://www.google.com/maps/contrib/110935773975756586932,,,1726,4.7,https://search.google.com/local/reviews?placeid=ChIJZWv2pE0j1moR_Hr0FFhT-8c&q=Things+to+do&authuser=0&hl=en&gl=AU,https://www.google.com/maps?cid=14410203070475827964,https://www.google.com/search?kgmid=/g/11c2kfvrd4,-37.888034,145.3176562,https://www.parks.vic.gov.au/places-to-see/parks/dandenong-ranges-national-park/things-to-do/1000-steps-walk?utm_source=google&utm_medium=maps&utm_campaign=GMB-2020,parks.vic.gov.au,"Wednesday: [Open 24 hours], Thursday: [Open 24 hours], Friday: [Open 24 hours], Saturday: [Open 24 hours], Sunday: [Open 24 hours], Monday: [Open 24 hours], Tuesday: [Open 24 hours]",https://lh5.googleusercontent.com/p/AF1QipNWfPRHGkdd8zb8O40ThQy8q8uctDmup0llyLf9=w157-h92-k-no,1.44102e+19,0x6ad6234da4f66b65:0xc7fb535814f47afc,ChIJZWv2pE0j1moR_Hr0FFhT-8c,/g/11c2kfvrd4
The Grange Reserve,,"136-176 Osborne Ave, Clayton South VIC 3169",136-176 Osborne Ave,Clayton South VIC 3169,"Tourist attraction, Park","Accessibility: [Wheelchair-accessible car park, Wheelchair-accessible entrance], Amenities: [Barbecue grill, Picnic tables, Public toilet, Slides, Swings], Children: [Good for kids, Good for kids birthday, Playground], Pets: [Dogs allowed]",4RJ7343J+GV,Australia/Melbourne,,,,,1300 653 356,"1300 653 356, +61 1300 653 356",NO,The Grange Reserve (owner),,,,,308,4.5,https://search.google.com/local/reviews?placeid=ChIJcUTyKEpr1moRoF0yBXZWBA8&q=Things+to+do&authuser=0&hl=en&gl=AU,https://www.google.com/maps?cid=1082084875369078176,https://www.google.com/search?kgmid=/g/1v3kn662,-37.9461479,145.1321259,http://www.kingston.vic.gov.au/Outdoors/Parks-Playgrounds/Playgrounds/The-Grange-Reserve-UFO-Park,kingston.vic.gov.au,"Wednesday: [Open 24 hours], Thursday: [Open 24 hours], Friday: [Open 24 hours], Saturday: [Open 24 hours], Sunday: [Open 24 hours], Monday: [Open 24 hours], Tuesday: [Open 24 hours]",https://lh5.googleusercontent.com/p/AF1QipM5Y92SD332BKrX6q1y_pFnz4LoH2iWd9MJcvlf=w122-h92-k-no,1.08208e+18,0x6ad66b4a28f24471:0xf04567605325da0,ChIJcUTyKEpr1moRoF0yBXZWBA8,/g/1v3kn662
Burden Park,,"Springvale Rd & Heatherton Road, Springvale South VIC 3172",Springvale Rd & Heatherton Road,Springvale South VIC 3172,"Tourist attraction, Park","Service options: [On-site services], Accessibility: [Wheelchair-accessible car park, Wheelchair-accessible entrance], Amenities: [Barbecue grill, Basketball court, Has a tennis court, Picnic tables, Public toilet, Slides, Swings], Children: [Good for kids, Good for kids birthday, Playground], Pets: [Dogs allowed]",4RJ725P2+JR,Australia/Melbourne,,,,,(03) 8571 1000,"(03) 8571 1000, +61 3 8571 1000",NO,Burden Park (owner),,,,,972,4.6,https://search.google.com/local/reviews?placeid=ChIJ20cFXKQU1moRMKcxBXZWBA8&q=Things+to+do&authuser=0&hl=en&gl=AU,https://www.google.com/maps?cid=1082084875369031472,https://www.google.com/search?kgmid=/g/11bxftqr59,-37.9634637,145.1521075,https://www.greaterdandenong.vic.gov.au/our-environment/open-spaces/burden-park,greaterdandenong.vic.gov.au,"Wednesday: [Open 24 hours], Thursday: [Open 24 hours], Friday: [Open 24 hours], Saturday: [Open 24 hours], Sunday: [Open 24 hours], Monday: [Open 24 hours], Tuesday: [Open 24 hours]",https://lh5.googleusercontent.com/p/AF1QipMEJ-e5PTw5AsjEb4MTYUNUFVaqkGCsRB0AK0IW=w163-h92-k-no,1.08208e+18,0x6ad614a45c0547db:0xf0456760531a730,ChIJ20cFXKQU1moRMKcxBXZWBA8,/g/11bxftqr59
Lysterfield Park,"Scenic waterfront park featuring trails for hiking & cycling, plus lake sports & kangaroo sightings.","Horswood Rd, Lysterfield VIC 3156",Horswood Rd,Lysterfield VIC 3156,"Tourist attraction, Park","Service options: [On-site services], Accessibility: [Wheelchair-accessible car park, Wheelchair-accessible entrance], Activities: [Hiking], Amenities: [Barbecue grill, Picnic tables, Public toilet], Children: [Good for kids, Good for kids birthday, Kid-friendly hikes]",4RJ728M2+Q6,Australia/Melbourne,,,,,13 19 63,"13 19 63, +61 131963",YES,Lysterfield Park (owner),1.17636e+20,https://www.google.com/maps/contrib/117636146643849109312,,,3937,4.7,https://search.google.com/local/reviews?placeid=ChIJvc2NkuMX1moRAD0xBXZWBA8&q=Things+to+do&authuser=0&hl=en&gl=AU,https://www.google.com/maps?cid=1082084875369004288,https://www.google.com/search?kgmid=/m/0c0hbj,-37.9656037,145.300577,https://www.parks.vic.gov.au/places-to-see/parks/lysterfield-park?utm_source=google&utm_medium=maps&utm_campaign=GMB-2020,parks.vic.gov.au,"Wednesday: [Open 24 hours], Thursday: [Open 24 hours], Friday: [Open 24 hours], Saturday: [Open 24 hours], Sunday: [Open 24 hours], Monday: [Open 24 hours], Tuesday: [Open 24 hours]",https://lh5.googleusercontent.com/p/AF1QipME5fAuqxAoITn-dI4RtqxBm9fk_sMS1Zr2Wye9=w157-h92-k-no,1.08208e+18,0x6ad617e3928dcdbd:0xf04567605313d00,ChIJvc2NkuMX1moRAD0xBXZWBA8,/m/0c0hbj
George Pentland Botanic Gardens,,"41N Williams St, Frankston VIC 3199",41N Williams St,Frankston VIC 3199,"Tourist attraction, Botanical garden","Accessibility: [Wheelchair-accessible car park, Wheelchair-accessible entrance], Amenities: [Barbecue grill, Picnic tables, Public toilet, Slides, Swings], Children: [Good for kids, Good for kids birthday, Playground]",4RH7R4WH+VG,Australia/Melbourne,,,,,1300 322 322,"1300 322 322, +61 1300 322 322",NO,George Pentland Botanic Gardens (owner),,,,,787,4.6,https://search.google.com/local/reviews?placeid=ChIJgzxHMCl11moRuODdIMDCL98&q=Things+to+do&authuser=0&hl=en&gl=AU,https://www.google.com/maps?cid=16082286924804251832,https://www.google.com/search?kgmid=/g/11ckrjf9v5,-38.15285,145.1288621,http://www.frankston.vic.gov.au/Things_To_Do/Parks_and_Reserves/Frankston/George_Pentland_Botanic_Gardens,frankston.vic.gov.au,"Wednesday: [Open 24 hours], Thursday: [Open 24 hours], Friday: [Open 24 hours], Saturday: [Open 24 hours], Sunday: [Open 24 hours], Monday: [Open 24 hours], Tuesday: [Open 24 hours]",https://lh5.googleusercontent.com/p/AF1QipNyWY_lWjSuNJD5N8CqahaELf0R9k3U62-4XYS7=w122-h92-k-no,1.60823e+19,0x6ad6752930473c83:0xdf2fc2c020dde0b8,ChIJgzxHMCl11moRuODdIMDCL98,/g/11ckrjf9v5
