Name,Description,Fulladdress,Street,Municipality,Categories,About,Plus Code,Time Zone,Price,Note,Amenities,Hotel Class,Phone,Phones,Claimed,Owner,Owner Id,Owner Link,Email,Social Medias,Review Count,Average Rating,Review URL,Google Maps URL,Google Knowledge URL,Latitude,Longitude,Website,Domain,Opening Hours,Featured Image,Cid,Fid,Place Id,Kgmid
Royal Botanic Gardens Victoria - Melbourne Gardens,"36-hectare botanic garden founded in 1846, planted with Australian species and non-native gardens.",Melbourne VIC 3004,Melbourne VIC 3004,,"Tourist attraction, Botanical garden","Service options: [On-site services], Accessibility: [Wheelchair-accessible car park, Wheelchair-accessible entrance, Wheelchair-accessible toilet], Activities: [Hiking], Amenities: [Picnic tables, Public toilet, Toilets], Children: [Good for kids, Good for kids birthday, Kid-friendly hikes], Pets: [Dogs allowed]",4RJ65X9J+W3,Australia/Melbourne,,,,,(03) 9252 2300,"(03) 9252 2300, +61 3 9252 2300",YES,Royal Botanic Gardens Victoria - Melbourne Gardens (owner),1.12436e+20,https://www.google.com/maps/contrib/112436479398252766259,,,16539,4.8,https://search.google.com/local/reviews?placeid=ChIJO40p-5ZC1moRwNcxBXZWBA8&q=Things+to+do&authuser=0&hl=en&gl=AU,https://www.google.com/maps?cid=1082084875369043904,https://www.google.com/search?kgmid=/m/0509dt,-37.8302443,144.9801496,https://www.rbg.vic.gov.au/,rbg.vic.gov.au,"Wednesday: [7:30 am-7:30 pm], Thursday: [7:30 am-7:30 pm], Friday: [7:30 am-7:30 pm], Saturday: [7:30 am-7:30 pm], Sunday: [7:30 am-7:30 pm], Monday: [7:30 am-7:30 pm], Tuesday: [7:30 am-7:30 pm]",https://lh5.googleusercontent.com/p/AF1QipNr16xQjl9PqqLfiXee9kHtLv7xu-kvjiBPdeWw=w122-h92-k-no,1.08208e+18,0x6ad64296fb298d3b:0xf0456760531d7c0,ChIJO40p-5ZC1moRwNcxBXZWBA8,/m/0509dt
Fed Square,"Abstract buildings flank this block-size plaza, filled with restaurants, museums and arts venues.","Swanston St & Flinders St, Melbourne VIC 3000",Swanston St & Flinders St,Melbourne VIC 3000,"Plaza, Art center, Art gallery, Civic center, Community center, Conference center, Event venue, Tourist attraction","Service options: [On-site services], Accessibility: [Wheelchair-accessible car park, Wheelchair-accessible entrance], Amenities: [Gender-neutral toilets]",4RJ65XJ9+RJ,Australia/Melbourne,,,,,(03) 9655 1900,"(03) 9655 1900, +61 3 9655 1900",YES,Fed Square (owner),1.16987e+20,https://www.google.com/maps/contrib/116986566868410510750,,,2741,4.5,https://search.google.com/local/reviews?placeid=ChIJT8T86bZC1moRqw7W6kVH5zg&q=Things+to+do&authuser=0&hl=en&gl=AU,https://www.google.com/maps?cid=4100324351362338475,https://www.google.com/search?kgmid=/m/02737h,-37.8179789,144.9690576,https://www.fedsquare.com/,fedsquare.com,"Wednesday: [Open 24 hours], Thursday: [Open 24 hours], Friday: [Open 24 hours], Saturday: [Open 24 hours], Sunday: [Open 24 hours], Monday: [Open 24 hours], Tuesday: [Open 24 hours]",https://lh5.googleusercontent.com/p/AF1QipOagdxjFkB5jmhQ08F3BeKzPkZeXf7wANo_IL9H=w122-h92-k-no,4.10032e+18,0x6ad642b6e9fcc44f:0x38e74745ead60eab,ChIJT8T86bZC1moRqw7W6kVH5zg,/m/02737h
Melbourne Skydeck,Gold-plated observation deck on the 88th floor with panoramic city views & a protruding glass cube.,"7 Riverside Quay, Southbank VIC 3006",7 Riverside Quay,Southbank VIC 3006,"Tourist attraction, Observation deck","Service options: [On-site services], Accessibility: [Wheelchair-accessible car park, Wheelchair-accessible entrance], Planning: [Getting tickets in advance recommended], Children: [Good for kids]",4RJ65XH7+FV,Australia/Melbourne,,,,,(03) 9693 8888,"(03) 9693 8888, +61 3 9693 8888",YES,Melbourne Skydeck (owner),1.07752e+20,https://www.google.com/maps/contrib/107752270785723004141,,,15317,4.5,https://search.google.com/local/reviews?placeid=ChIJQffkhK1C1moR3Z0-w-t8SS8&q=Things+to+do&authuser=0&hl=en&gl=AU,https://www.google.com/maps?cid=3407391945117310429,https://www.google.com/search?kgmid=/m/02jkct,-37.8213341,144.9646982,https://www.melbourneskydeck.com.au/,melbourneskydeck.com.au,"Wednesday: [12-10 pm], Thursday: [12-10 pm], Friday: [12-10 pm], Saturday: [12-10 pm], Sunday: [12-10 pm], Monday: [12-10 pm], Tuesday: [12-10 pm]",https://lh5.googleusercontent.com/p/AF1QipPZ0pK28Jh1_oHefUikNk8Chn3ugcQVZgTGKbDW=w122-h92-k-no,3.40739e+18,0x6ad642ad84e4f741:0x2f497cebc33e9ddd,ChIJQffkhK1C1moR3Z0-w-t8SS8,/m/02jkct
Under The Clocks,,"295 Flinders St, Melbourne VIC 3000",295 Flinders St,Melbourne VIC 3000,Tourist attraction,"Accessibility: [Wheelchair-accessible entrance], Children: [Good for kids]",4RJ65XJ8+VW,Australia/Melbourne,,,,,,,NO,Under The Clocks (owner),,,,,119,4.6,https://search.google.com/local/reviews?placeid=ChIJAQ_QorZC1moRSx1cleDxw-4&q=Things+to+do&authuser=0&hl=en&gl=AU,https://www.google.com/maps?cid=17204860948366237003,https://www.google.com/search?kgmid=/g/11ddxtygyf,-37.8178614,144.9673341,,,"Wednesday: [Open 24 hours], Thursday: [Open 24 hours], Friday: [Open 24 hours], Saturday: [Open 24 hours], Sunday: [Open 24 hours], Monday: [Open 24 hours], Tuesday: [Open 24 hours]",https://lh5.googleusercontent.com/p/AF1QipOVcDFj68fa-gIynPqoS-3HCL3LFAQ-oO_JkxVc=w122-h92-k-no,1.72049e+19,0x6ad642b6a2d00f01:0xeec3f1e0955c1d4b,ChIJAQ_QorZC1moRSx1cleDxw-4,/g/11ddxtygyf
SEA LIFE Melbourne Aquarium,"Interactive multilevel aquarium housing 10,000+ animals, including sharks & saltwater crocodiles.","King St, Melbourne VIC 3000",King St,Melbourne VIC 3000,"Tourist attraction, Event venue, Aquarium","Service options: [On-site services], Accessibility: [Wheelchair-accessible car park, Wheelchair-accessible entrance], Planning: [Getting tickets in advance recommended], Children: [Good for kids]",4RJ65XH5+P7,Australia/Melbourne,,,,,,,YES,SEA LIFE Melbourne Aquarium (owner),1.00011e+20,https://www.google.com/maps/contrib/100010667614614639646,,"facebook: https://www.facebook.com/melbourneaquarium/
instagram: https://www.instagram.com/sealifemelbourneaquarium/?hl=en
",16315,4.3,https://search.google.com/local/reviews?placeid=ChIJ_QzhcE1d1moR9rtoKagNPOI&q=Things+to+do&authuser=0&hl=en&gl=AU,https://www.google.com/maps?cid=16301919767074749430,https://www.google.com/search?kgmid=/m/0b7xrh,-37.820627,144.95822,https://www.visitsealife.com/melbourne/?utm_source=gmb&utm_medium=organic&utm_campaign=yext&utm_content=2,visitsealife.com,"Wednesday: [10 am-5 pm], Thursday: [10 am-5 pm], Friday: [10 am-5 pm], Saturday: [10 am-5 pm], Sunday: [10 am-5 pm], Monday: [10 am-5 pm], Tuesday: [10 am-5 pm]",https://lh5.googleusercontent.com/p/AF1QipMWrFf5pXDkG58fj4-CPaoC0obc35V1RnFWUtxX=w80-h106-k-no,1.63019e+19,0x6ad65d4d70e10cfd:0xe23c0da82968bbf6,ChIJ_QzhcE1d1moR9rtoKagNPOI,/m/0b7xrh
Batman Park,,"2A Spencer St, Melbourne VIC 3000",2A Spencer St,Melbourne VIC 3000,"Tourist attraction, Park","Service options: [On-site services], Accessibility: [Wheelchair-accessible entrance], Children: [Good for kids], Pets: [Dogs allowed]",4RJ65XH4+7H,Australia/Melbourne,,,,,(03) 9658 9658,"(03) 9658 9658, +61 3 9658 9658",NO,Batman Park (owner),,,,,608,4.3,https://search.google.com/local/reviews?placeid=ChIJG0SLSFJd1moRMWiHXt2cag4&q=Things+to+do&authuser=0&hl=en&gl=AU,https://www.google.com/maps?cid=1038815138649958449,https://www.google.com/search?kgmid=/m/057vbtn,-37.8217763,144.9564845,http://www.melbournepoint.com.au/parks/batman-park/,melbournepoint.com.au,"Wednesday: [Open 24 hours], Thursday: [Open 24 hours], Friday: [Open 24 hours], Saturday: [Open 24 hours], Sunday: [Open 24 hours], Monday: [Open 24 hours], Tuesday: [Open 24 hours]",https://lh5.googleusercontent.com/p/AF1QipOdo5aOWyTdkaMvwXosPHR6s-cuZjhe7WztiZJl=w80-h106-k-no,1.03882e+18,0x6ad65d52488b441b:0xe6a9cdd5e876831,ChIJG0SLSFJd1moRMWiHXt2cag4,/m/057vbtn
Parliament Gardens,,"489/531 Albert St, East Melbourne VIC 3002",489/531 Albert St,East Melbourne VIC 3002,"Tourist attraction, Park","Accessibility: [Wheelchair-accessible car park, Wheelchair-accessible entrance], Children: [Good for kids], Pets: [Dogs allowed]",4RJ65XRF+5C,Australia/Melbourne,,,,,,,NO,Parliament Gardens (owner),,,,,689,4.5,https://search.google.com/local/reviews?placeid=ChIJcfRKl8VC1moRwIUxBXZWBA8&q=Things+to+do&authuser=0&hl=en&gl=AU,https://www.google.com/maps?cid=1082084875369022912,https://www.google.com/search?kgmid=/g/1ym82wpwp,-37.8095207,144.973526,http://www.melbournepoint.com.au/parks/parliament-gardens/,melbournepoint.com.au,"Wednesday: [Open 24 hours], Thursday: [Open 24 hours], Friday: [Open 24 hours], Saturday: [Open 24 hours], Sunday: [Open 24 hours], Monday: [Open 24 hours], Tuesday: [Open 24 hours]",https://lh5.googleusercontent.com/p/AF1QipNiwPcYupSybDheczaae67qxoKC6tIpgdOeokZl=w122-h92-k-no,1.08208e+18,0x6ad642c5974af471:0xf045676053185c0,ChIJcfRKl8VC1moRwIUxBXZWBA8,/g/1ym82wpwp
Melbourne Museum,Modern building of an institution founded in 1854 containing dinosaur and regional history exhibits.,"11 Nicholson St, Carlton VIC 3053",11 Nicholson St,Carlton VIC 3053,"Tourist attraction, Museum, Natural history museum, History museum, Wedding venue","Service options: [On-site services], Accessibility: [Wheelchair-accessible car park, Wheelchair-accessible entrance, Wheelchair-accessible seating, Wheelchair-accessible toilet, ], Amenities: [Gender-neutral toilets, Restaurant, Toilets, Wi-Fi, ], Crowd: [Family friendly, LGBTQ+ friendly, Transgender safe space], Planning: [Getting tickets in advance recommended], Children: [Discounts for kids, Good for kids, Has changing table(s), Kid-friendly activities, Nursing room]",4RJ65XWC+MM,Australia/Melbourne,,,,,13 11 02,"13 11 02, +61 131102",YES,Melbourne Museum (owner),1.00253e+20,https://www.google.com/maps/contrib/100253097724051678566,,,16315,4.6,https://search.google.com/local/reviews?placeid=ChIJn97JQNpC1moRIcJsVMEQLI8&q=Things+to+do&authuser=0&hl=en&gl=AU,https://www.google.com/maps?cid=10316639268930109985,https://www.google.com/search?kgmid=/m/01k1wc,-37.803273,144.9717408,https://museumsvictoria.com.au/melbournemuseum,museumsvictoria.com.au,"Wednesday: [9 am-5 pm], Thursday: [9 am-5 pm], Friday: [9 am-5 pm], Saturday: [9 am-5 pm], Sunday: [9 am-5 pm], Monday: [9 am-5 pm], Tuesday: [9 am-5 pm]",https://lh5.googleusercontent.com/p/AF1QipNWUeBaqTw8uEPQX4nf9Xx3kJqMABa1bvT0KzNs=w122-h92-k-no,1.03166e+19,0x6ad642da40c9de9f:0x8f2c10c1546cc221,ChIJn97JQNpC1moRIcJsVMEQLI8,/m/01k1wc
Chinatown Melbourne,"Vibrant, historic neighborhood offering numerous Chinese eateries, shops & cultural events.","Little Bourke St, Melbourne VIC 3000",Little Bourke St,Melbourne VIC 3000,"Tourist attraction, Restaurant, Historical landmark","Service options: [On-site services], Accessibility: [Wheelchair-accessible car park, Wheelchair-accessible entrance], Children: [Good for kids]",4RJ65XQ8+5P,Australia/Melbourne,,,,,0474 043 600,"0474 043 600, +61 474 043 600",YES,Chinatown Melbourne (owner),1.17151e+20,https://www.google.com/maps/contrib/117150580714277775676,,,6571,4.3,https://search.google.com/local/reviews?placeid=ChIJczgQh8lC1moR9r9gP44FRvY&q=Things+to+do&authuser=0&hl=en&gl=AU,https://www.google.com/maps?cid=17745877490206818294,https://www.google.com/search?kgmid=/m/0ghfj0,-37.812006,144.9668036,http://chinatownmelbourne.com.au/,chinatownmelbourne.com.au,"Wednesday: [Open 24 hours], Thursday: [Open 24 hours], Friday: [Open 24 hours], Saturday: [Open 24 hours], Sunday: [Open 24 hours], Monday: [Open 24 hours], Tuesday: [Open 24 hours]",https://lh5.googleusercontent.com/p/AF1QipMqaWjxOSBGiM9Wc3sM85GL99uTtdp7c_vpOcB0=w80-h106-k-no,1.77459e+19,0x6ad642c987103873:0xf646058e3f60bff6,ChIJczgQh8lC1moR9r9gP44FRvY,/m/0ghfj0
Alexandra Gardens,"Waterfront park with walking & cycling trails, a BBQ/picnic area, skate park, playground & cafe.","Alexandra Gardens Skate Park, 3 Boathouse Dr, Melbourne VIC 3004",Alexandra Gardens Skate Park,3 Boathouse Dr,"Tourist attraction, Park, Garden","Accessibility: [Wheelchair-accessible car park, Wheelchair-accessible entrance], Amenities: [Picnic tables, Public toilet, Skateboarding area], Children: [Good for kids], Pets: [Dogs allowed]",4RJ65XHC+RV,Australia/Melbourne,,,,,(03) 9658 9658,"(03) 9658 9658, +61 3 9658 9658",NO,Alexandra Gardens (owner),,,,,1520,4.6,https://search.google.com/local/reviews?placeid=ChIJc8A97rlC1moRUPD0CXZWBB0&q=Things+to+do&authuser=0&hl=en&gl=AU,https://www.google.com/maps?cid=2090891191979929680,https://www.google.com/search?kgmid=/m/0627jr,-37.8204318,144.9721339,https://www.melbourne.vic.gov.au/community/parks-open-spaces/major-parks-gardens/Pages/alexandra-gardens.aspx,melbourne.vic.gov.au,"Wednesday: [Open 24 hours], Thursday: [Open 24 hours], Friday: [Open 24 hours], Saturday: [Open 24 hours], Sunday: [Open 24 hours], Monday: [Open 24 hours], Tuesday: [Open 24 hours]",https://lh5.googleusercontent.com/p/AF1QipNqZDV1tOG_WbxK4W2Qsrvc5ENGhJ8bSIujp4RQ=w122-h92-k-no,2.09089e+18,0x6ad642b9ee3dc073:0x1d04567609f4f050,ChIJc8A97rlC1moRUPD0CXZWBB0,/m/0627jr
Yarra Bend Park,"Expansive area of natural bushland featuring playing fields, golf courses & a river for boating.","Yarra Bend Rd, Fairfield VIC 3078",Yarra Bend Rd,Fairfield VIC 3078,"Tourist attraction, Park","Accessibility: [Wheelchair-accessible car park, Wheelchair-accessible entrance], Activities: [Hiking], Amenities: [Barbecue grill, Picnic tables, Public toilet], Children: [Good for kids, Good for kids birthday, Kid-friendly hikes], Pets: [Dog park, Dogs allowed]",4RJ76226+QV,Australia/Melbourne,$$$,,,,13 19 63,"13 19 63, +61 131963",YES,Yarra Bend Park (owner),1.06032e+20,https://www.google.com/maps/contrib/106032239197616366837,,,1082,4.6,https://search.google.com/local/reviews?placeid=ChIJk2JeGKdD1moRENsxBXZWBA8&q=Things+to+do&authuser=0&hl=en&gl=AU,https://www.google.com/maps?cid=1082084875369044752,https://www.google.com/search?kgmid=/m/0gsg_8,-37.7980778,145.0122132,https://www.parks.vic.gov.au/places-to-see/parks/yarra-bend-park?utm_source=google&utm_medium=maps&utm_campaign=GMB-2020,parks.vic.gov.au,"Wednesday: [Open 24 hours], Thursday: [Open 24 hours], Friday: [Open 24 hours], Saturday: [Open 24 hours], Sunday: [Open 24 hours], Monday: [Open 24 hours], Tuesday: [Open 24 hours]",https://lh5.googleusercontent.com/p/AF1QipMn3rhZNJ3R3pqo5uahAi7YFp_zC5Dd0Rz_jmm7=w157-h92-k-no,1.08208e+18,0x6ad643a7185e6293:0xf0456760531db10,ChIJk2JeGKdD1moRENsxBXZWBA8,/m/0gsg_8
Scienceworks (Museums Victoria),Family-focused science & technology center featuring changing interactive exhibits & a planetarium.,"2 Booker St, Spotswood VIC 3015",2 Booker St,Spotswood VIC 3015,"Tourist attraction, Museum, Science museum","Service options: [On-site services], Highlights: [Live performances], Accessibility: [Wheelchair-accessible car park, Wheelchair-accessible entrance, Wheelchair-accessible seating, Wheelchair-accessible toilet, ], Amenities: [Gender-neutral toilets, Restaurant, Toilets], Crowd: [Family friendly, LGBTQ+ friendly, Transgender safe space], Planning: [Getting tickets in advance recommended], Children: [Discounts for kids, Good for kids, Has changing table(s), Kid-friendly activities, Nursing room]",4RJ65V9V+98,Australia/Melbourne,,,,,13 11 02,"13 11 02, +61 131102",YES,Scienceworks (Museums Victoria) (owner),1.00433e+20,https://www.google.com/maps/contrib/100432504687660991749,,,6478,4.4,https://search.google.com/local/reviews?placeid=ChIJK-o8zD1n1moRrY94n9V-NLE&q=Things+to+do&authuser=0&hl=en&gl=AU,https://www.google.com/maps?cid=12768970299470811053,https://www.google.com/search?kgmid=/m/02q3k3f,-37.8315109,144.8933119,https://museumsvictoria.com.au/scienceworks/,museumsvictoria.com.au,"Wednesday: [10 am-4:30 pm], Thursday: [10 am-4:30 pm], Friday: [10 am-4:30 pm], Saturday: [10 am-4:30 pm], Sunday: [10 am-4:30 pm], Monday: [10 am-4:30 pm], Tuesday: [10 am-4:30 pm]",https://lh5.googleusercontent.com/p/AF1QipPltpXeX9_M_WXCrvrC9mwsydjvbrHDIw7xr8oc=w122-h92-k-no,1.2769e+19,0x6ad6673dcc3cea2b:0xb1347ed59f788fad,ChIJK-o8zD1n1moRrY94n9V-NLE,/m/02q3k3f
St Kilda Botanical Gardens,"Historical gardens featuring a rosary, flower beds & exotic trees, plus a pond & giant chess board.","11 Herbert St, St Kilda VIC 3182",11 Herbert St,St Kilda VIC 3182,"Tourist attraction, Park, Botanical garden","Service options: [On-site services], Accessibility: [Wheelchair-accessible car park, Wheelchair-accessible entrance], Amenities: [Picnic tables, Public toilet, Slides, Swings, Toilets], Children: [Good for kids, Good for kids birthday, Playground], Pets: [Dogs allowed]",4RJ64XHM+MH,Australia/Melbourne,,,,,(03) 9209 6777,"(03) 9209 6777, +61 3 9209 6777",YES,St Kilda Botanical Gardens (owner),1.0521e+20,https://www.google.com/maps/contrib/105209712324945631746,,,3003,4.6,https://search.google.com/local/reviews?placeid=ChIJuUYj411o1moRIJQxBXZWBA8&q=Things+to+do&authuser=0&hl=en&gl=AU,https://www.google.com/maps?cid=1082084875369026592,https://www.google.com/search?kgmid=/m/02qh02n,-37.8708601,144.983954,https://www.portphillip.vic.gov.au/explore-the-city/beaches-parks-and-playgrounds/find-parks-and-playgrounds/st-kilda-botanical-gardens,portphillip.vic.gov.au,"Wednesday: [Open 24 hours], Thursday: [Open 24 hours], Friday: [Open 24 hours], Saturday: [Open 24 hours], Sunday: [Open 24 hours], Monday: [Open 24 hours], Tuesday: [Open 24 hours]",https://lh5.googleusercontent.com/p/AF1QipPNTWnMqhzZK5JRXodFFBvD0q6GOjmdSHQjYPIf=w137-h92-k-no,1.08208e+18,0x6ad6685de32346b9:0xf04567605319420,ChIJuUYj411o1moRIJQxBXZWBA8,/m/02qh02n
Flagstaff Gardens,"Spacious, tranquil park with landscaped gardens & sculptures, plus picnic & recreational facilities.","309-311 William St, West Melbourne VIC 3003",309-311 William St,West Melbourne VIC 3003,"Tourist attraction, State park, Park","Service options: [On-site services], Accessibility: [Wheelchair-accessible car park, Wheelchair-accessible entrance], Amenities: [Has a tennis court, Picnic tables, Public toilet, Slides, Swings], Children: [Good for kids, Good for kids birthday, Playground], Pets: [Dog park, Dogs allowed]",4RJ65XQ3+QR,Australia/Melbourne,,,,,(03) 9658 9658,"(03) 9658 9658, +61 3 9658 9658",NO,Flagstaff Gardens (owner),,,,"yelp: https://www.yelp.com/biz/flagstaff-gardens-melbourne
",7225,4.6,https://search.google.com/local/reviews?placeid=ChIJnQHt6Uld1moRgIUxBXZWBA8&q=Things+to+do&authuser=0&hl=en&gl=AU,https://www.google.com/maps?cid=1082084875369022848,https://www.google.com/search?kgmid=/m/05jc35,-37.8105577,144.9545199,https://www.melbourne.vic.gov.au/community/parks-open-spaces/Pages/parks-open-spaces.aspx,melbourne.vic.gov.au,"Wednesday: [Open 24 hours], Thursday: [Open 24 hours], Friday: [Open 24 hours], Saturday: [Open 24 hours], Sunday: [Open 24 hours], Monday: [Open 24 hours], Tuesday: [Open 24 hours]",https://lh5.googleusercontent.com/p/AF1QipOG_BqfCmmmXMhHpRBeAOjcZ0akppyRcdOXdRq1=w122-h92-k-no,1.08208e+18,0x6ad65d49e9ed019d:0xf04567605318580,ChIJnQHt6Uld1moRgIUxBXZWBA8,/m/05jc35
Webb Bridge,,"Capital City Trail, Docklands VIC 3008",Capital City Trail,Docklands VIC 3008,"Bridge, Tourist attraction","Service options: [On-site services], Accessibility: [Wheelchair-accessible entrance]",4RJ65WGW+MW,Australia/Melbourne,,,,,,,NO,Webb Bridge (owner),,,,,1292,4.5,https://search.google.com/local/reviews?placeid=ChIJg4X9-Fhd1moRxMMEfYtp6Pw&q=Things+to+do&authuser=0&hl=en&gl=AU,https://www.google.com/maps?cid=18223931939973546948,https://www.google.com/search?kgmid=/g/11bvg21716,-37.823352,144.9473047,https://www.development.vic.gov.au/projects/docklands/yarras-edge,development.vic.gov.au,"Wednesday: [Open 24 hours], Thursday: [Open 24 hours], Friday: [Open 24 hours], Saturday: [Open 24 hours], Sunday: [Open 24 hours], Monday: [Open 24 hours], Tuesday: [Open 24 hours]",https://lh5.googleusercontent.com/p/AF1QipMUUrvduy8JPAut7VwPeo_PBjInBACodktbAxro=w122-h92-k-no,1.82239e+19,0x6ad65d58f8fd8583:0xfce8698b7d04c3c4,ChIJg4X9-Fhd1moRxMMEfYtp6Pw,/g/11bvg21716
The Fairies Tree,,"230-298 Wellington Parade, East Melbourne VIC 3002",230-298 Wellington Parade,East Melbourne VIC 3002,Tourist attraction,"Accessibility: [Wheelchair-accessible car park, Wheelchair-accessible entrance], Children: [Good for kids]",4RJ65XPJ+JC,Australia/Melbourne,,,,,(03) 9658 9658,"(03) 9658 9658, +61 3 9658 9658",NO,The Fairies Tree (owner),,,,,101,4.5,https://search.google.com/local/reviews?placeid=ChIJcy76L8JC1moRohC5yD7D7oo&q=Things+to+do&authuser=0&hl=en&gl=AU,https://www.google.com/maps?cid=10011153696114151586,https://www.google.com/search?kgmid=/g/11cjpbxkdy,-37.8134393,144.9810907,http://www.fitzroygardens.com/,fitzroygardens.com,"Wednesday: [Open 24 hours], Thursday: [Open 24 hours], Friday: [Open 24 hours], Saturday: [Open 24 hours], Sunday: [Open 24 hours], Monday: [Open 24 hours], Tuesday: [Open 24 hours]",https://lh5.googleusercontent.com/p/AF1QipNvFnGgj95z6Kblce74p1XdS9S9TUtQJneNeiV_=w122-h92-k-no,1.00112e+19,0x6ad642c22ffa2e73:0x8aeec33ec8b910a2,ChIJcy76L8JC1moRohC5yD7D7oo,/g/11cjpbxkdy
Kings Domain,"89 acres of parkland by the river, with an outdoor performance venue, war memorial & gardens.","Alexandra Ave, Melbourne VIC 3004",Alexandra Ave,Melbourne VIC 3004,"Tourist attraction, Park","Accessibility: [Wheelchair-accessible car park, Wheelchair-accessible entrance], Amenities: [Picnic tables, Public toilet], Children: [Good for kids], Pets: [Dogs allowed]",4RJ65XGF+89,Australia/Melbourne,,,,,(03) 9658 9658,"(03) 9658 9658, +61 3 9658 9658",NO,Kings Domain (owner),,,,,4809,4.6,https://search.google.com/local/reviews?placeid=ChIJoS72YKNC1moRL-iksMO0MqE&q=Things+to+do&authuser=0&hl=en&gl=AU,https://www.google.com/maps?cid=11615545141517150255,https://www.google.com/search?kgmid=/m/06bwfr,-37.8241558,144.9734846,https://www.melbourne.vic.gov.au/community/parks-open-spaces/major-parks-gardens/Pages/kings-domain.aspx,melbourne.vic.gov.au,"Wednesday: [Open 24 hours], Thursday: [Open 24 hours], Friday: [Open 24 hours], Saturday: [Open 24 hours], Sunday: [Open 24 hours], Monday: [Open 24 hours], Tuesday: [Open 24 hours]",https://lh5.googleusercontent.com/p/AF1QipO19xHXzCH3jxXvnKq73eaWSwdjeQUn240QHPVD=w122-h92-k-no,1.16155e+19,0x6ad642a360f62ea1:0xa132b4c3b0a4e82f,ChIJoS72YKNC1moRL-iksMO0MqE,/m/06bwfr
Melbourne Zoo,"Modelled on London Zoo, this family-friendly establishment has animals from all around the world.","Elliott Ave, Parkville VIC 3052",Elliott Ave,Parkville VIC 3052,"Tourist attraction, Animal hospital, Learning center, Zoo, Wildlife park, Wildlife rescue service","Service options: [On-site services], Accessibility: [Wheelchair-accessible car park, Wheelchair-accessible entrance], Planning: [Getting tickets in advance recommended], Children: [Good for kids, Good for kids birthday]",4RJ66X82+8J,Australia/Melbourne,,,,,1300 966 784,"1300 966 784, +61 1300 966 784",YES,Melbourne Zoo (owner),1.05876e+20,https://www.google.com/maps/contrib/105876162537862663224,,,5635,4.4,https://search.google.com/local/reviews?placeid=ChIJl4pG29Bc1moRisNvMITeH7Y&q=Things+to+do&authuser=0&hl=en&gl=AU,https://www.google.com/maps?cid=13123452498510594954,https://www.google.com/search?kgmid=/m/03tprv,-37.7841346,144.9515473,https://www.zoo.org.au/melbourne,zoo.org.au,"Wednesday: [9 am-5 pm], Thursday: [9 am-5 pm], Friday: [9 am-5 pm], Saturday: [9 am-5 pm], Sunday: [9 am-5 pm], Monday: [9 am-5 pm], Tuesday: [9 am-5 pm]",https://lh5.googleusercontent.com/p/AF1QipM-PqpOq_RMGVfAbsmr6oCPNacbt1E4dFMsrXLE=w122-h92-k-no,1.31235e+19,0x6ad65cd0db468a97:0xb61fde84306fc38a,ChIJl4pG29Bc1moRisNvMITeH7Y,/m/03tprv
Fitzroy Gardens,"Historic 26-hectare site in city centre with model Tudor village, tree-lined walking paths & cafes.","Wellington Parade, East Melbourne VIC 3002",Wellington Parade,East Melbourne VIC 3002,"Park, Garden","Service options: [On-site services], Accessibility: [Wheelchair-accessible car park, Wheelchair-accessible entrance], Amenities: [Public toilet], Children: [Good for kids], Pets: [Dogs allowed]",4RJ65XPJ+W2,Australia/Melbourne,,,,,(03) 9658 9658,"(03) 9658 9658, +61 3 9658 9658",NO,Fitzroy Gardens (owner),,,,,6397,4.7,https://search.google.com/local/reviews?placeid=ChIJX6ytzMNC1moREIYxBXZWBA8&q=Things+to+do&authuser=0&hl=en&gl=AU,https://www.google.com/maps?cid=1082084875369022992,https://www.google.com/search?kgmid=/m/05mn_s,-37.8127215,144.9800679,https://www.melbourne.vic.gov.au/community/parks-open-spaces/major-parks-gardens/pages/fitzroy-gardens.aspx,melbourne.vic.gov.au,"Wednesday: [Open 24 hours], Thursday: [Open 24 hours], Friday: [Open 24 hours], Saturday: [Open 24 hours], Sunday: [Open 24 hours], Monday: [Open 24 hours], Tuesday: [Open 24 hours]",https://lh5.googleusercontent.com/p/AF1QipM_9f7zanzB5kKN-YiQqjdQkl-H13ulPjIJe2Mz=w122-h92-k-no,1.08208e+18,0x6ad642c3ccadac5f:0xf04567605318610,ChIJX6ytzMNC1moREIYxBXZWBA8,/m/05mn_s
Dights Falls,,"112A Trenerry Cres, Abbotsford VIC 3067",112A Trenerry Cres,Abbotsford VIC 3067,"Tourist attraction, Hiking area, Weir","Accessibility: [Wheelchair-accessible car park, Wheelchair-accessible entrance]",4RJ76232+5F,Australia/Melbourne,,,,,(03) 9205 5555,"(03) 9205 5555, +61 3 9205 5555",YES,Dights Falls (owner),1.12429e+20,https://www.google.com/maps/contrib/112428537972692228792,,,330,4.6,https://search.google.com/local/reviews?placeid=ChIJ6W78oQhD1moREsJpTtb1TH0&q=Things+to+do&authuser=0&hl=en&gl=AU,https://www.google.com/maps?cid=9028861653758362130,https://www.google.com/search?kgmid=/m/05ly8f,-37.7970165,145.0011326,,,"Wednesday: [Open 24 hours], Thursday: [Open 24 hours], Friday: [Open 24 hours], Saturday: [Open 24 hours], Sunday: [Open 24 hours], Monday: [Open 24 hours], Tuesday: [Open 24 hours]",https://lh5.googleusercontent.com/p/AF1QipMNAUPut_3xJuYnf_pWbCnGrzJr9ZjSQVso5_nK=w122-h92-k-no,9.02886e+18,0x6ad64308a1fc6ee9:0x7d4cf5d64e69c212,ChIJ6W78oQhD1moREsJpTtb1TH0,/m/05ly8f
